{
  "$schema": "../../docs/model.schema.json",
  "provider": "fal",
  "family": "Seedance 2",
  "category": "fal.ai/Video Generation",
  "nodes": [
    {
      "id": "seedance2_txt2vid",
      "name": "Seedance 2 (txt2vid)",
      "endpoint": "bytedance/seedance-2.0/text-to-video",
      "inputs": [
        { "name": "prompt", "data_type": "STRING", "api_field": "prompt", "required": true }
      ],
      "outputs": [
        { "name": "video", "data_type": "VIDEO", "api_field": "video" }
      ],
      "parameters": [
        { "name": "resolution", "label": "Resolution", "type": "enum", "api_field": "resolution", "default": "720p", "options": ["480p", "720p", "1080p", "4k"] },
        { "name": "aspect_ratio", "label": "Aspect Ratio", "type": "enum", "api_field": "aspect_ratio", "default": "16:9", "options": ["auto", "21:9", "16:9", "4:3", "1:1", "3:4", "9:16"] },
        { "name": "duration", "label": "Duration", "type": "enum", "api_field": "duration", "default": "auto", "options": ["auto", "4", "5", "6", "7", "8", "9", "10", "11", "12", "13", "14", "15"] },
        { "name": "generate_audio", "label": "Audio", "type": "bool", "api_field": "generate_audio", "default": true }
      ]
    },
    {
      "id": "seedance2_img2vid",
      "name": "Seedance 2 (img2vid)",
      "endpoint": "bytedance/seedance-2.0/image-to-video",
      "inputs": [
        { "name": "prompt", "data_type": "STRING", "api_field": "prompt", "required": true },
        { "name": "start_image", "data_type": "IMAGE", "api_field": "image_url", "required": true },
        { "name": "end_image", "data_type": "IMAGE", "api_field": "end_image_url" }
      ],
      "outputs": [
        { "name": "video", "data_type": "VIDEO", "api_field": "video" }
      ],
      "ref_roles": [
        { "role": "start", "api_field": "image_url", "max": 1 },
        { "role": "end", "api_field": "end_image_url", "max": 1 }
      ],
      "parameters": [
        { "name": "resolution", "label": "Resolution", "type": "enum", "api_field": "resolution", "default": "720p", "options": ["480p", "720p", "1080p", "4k"] },
        { "name": "duration", "label": "Duration", "type": "enum", "api_field": "duration", "default": "auto", "options": ["auto", "4", "5", "6", "7", "8", "9", "10", "11", "12", "13", "14", "15"] },
        { "name": "generate_audio", "label": "Audio", "type": "bool", "api_field": "generate_audio", "default": true }
      ]
    },
    {
      "id": "seedance2_ref2vid",
      "name": "Seedance 2 Fast (ref2vid)",
      "endpoint": "bytedance/seedance-2.0/fast/reference-to-video",
      "inputs": [
        { "name": "prompt", "data_type": "STRING", "api_field": "prompt", "required": true },
        { "name": "image_refs", "data_type": "IMAGE", "api_field": "image_urls", "api_format": "array", "max": 9 },
        { "name": "video_refs", "data_type": "VIDEO", "api_field": "video_urls", "api_format": "array", "max": 3 },
        { "name": "audio_refs", "data_type": "AUDIO", "api_field": "audio_urls", "api_format": "array", "max": 3 }
      ],
      "outputs": [
        { "name": "video", "data_type": "VIDEO", "api_field": "video" }
      ],
      "ref_roles": [
        { "role": "image", "api_field": "image_urls", "max": 9 }
      ],
      "parameters": [
        { "name": "resolution", "label": "Resolution", "type": "enum", "api_field": "resolution", "default": "720p", "options": ["480p", "720p"] },
        { "name": "aspect_ratio", "label": "Aspect Ratio", "type": "enum", "api_field": "aspect_ratio", "default": "16:9", "options": ["auto", "21:9", "16:9", "4:3", "1:1", "3:4", "9:16"] },
        { "name": "duration", "label": "Duration", "type": "enum", "api_field": "duration", "default": "auto", "options": ["auto", "4", "5", "6", "7", "8", "9", "10", "11", "12", "13", "14", "15"] },
        { "name": "generate_audio", "label": "Audio", "type": "bool", "api_field": "generate_audio", "default": true }
      ]
    },
    {
      "id": "seedance2_pro_ref2vid",
      "name": "Seedance 2 Pro (ref2vid)",
      "endpoint": "bytedance/seedance-2.0/reference-to-video",
      "inputs": [
        { "name": "prompt", "data_type": "STRING", "api_field": "prompt", "required": true },
        { "name": "image_refs", "data_type": "IMAGE", "api_field": "image_urls", "api_format": "array", "max": 9 },
        { "name": "video_refs", "data_type": "VIDEO", "api_field": "video_urls", "api_format": "array", "max": 3 },
        { "name": "audio_refs", "data_type": "AUDIO", "api_field": "audio_urls", "api_format": "array", "max": 3 }
      ],
      "outputs": [
        { "name": "video", "data_type": "VIDEO", "api_field": "video" }
      ],
      "ref_roles": [
        { "role": "image", "api_field": "image_urls", "max": 9 }
      ],
      "parameters": [
        { "name": "resolution", "label": "Resolution", "type": "enum", "api_field": "resolution", "default": "1080p", "options": ["480p", "720p", "1080p", "4k"] },
        { "name": "aspect_ratio", "label": "Aspect Ratio", "type": "enum", "api_field": "aspect_ratio", "default": "16:9", "options": ["auto", "21:9", "16:9", "4:3", "1:1", "3:4", "9:16"] },
        { "name": "duration", "label": "Duration", "type": "enum", "api_field": "duration", "default": "auto", "options": ["auto", "4", "5", "6", "7", "8", "9", "10", "11", "12", "13", "14", "15"] },
        { "name": "generate_audio", "label": "Audio", "type": "bool", "api_field": "generate_audio", "default": true }
      ]
    }
  ]
}
