{
  "$schema": "../../docs/model.schema.json",
  "provider": "replicate",
  "family": "Nano Banana 2",
  "category": "Replicate/Image Generation",
  "nodes": [
    {
      "id": "replicate_nano_banana_2_txt2img",
      "name": "Nano Banana 2 (txt2img)",
      "endpoint": "google/nano-banana-2",
      "inputs": [
        { "name": "prompt", "data_type": "STRING", "api_field": "prompt", "required": true }
      ],
      "outputs": [
        { "name": "images", "data_type": "IMAGE", "api_field": "images" }
      ],
      "parameters": [
        { "name": "aspect_ratio", "label": "Aspect Ratio", "type": "enum", "api_field": "aspect_ratio", "default": "1:1",
          "options": ["1:1", "4:3", "3:2", "16:9", "21:9", "5:4", "4:5", "3:4", "2:3", "9:16"] },
        { "name": "resolution", "label": "Resolution", "type": "enum", "api_field": "resolution", "default": "1K", "options": ["512px", "1K", "2K", "4K"] },
        { "name": "output_format", "label": "Format", "type": "enum", "api_field": "output_format", "default": "jpg", "options": ["png", "jpg"] },
        { "name": "safety_tolerance", "label": "Safety", "type": "int", "api_field": "safety_tolerance", "default": 2, "min": 1, "max": 6 },
        { "name": "seed", "label": "Seed", "type": "int", "api_field": "seed", "default": -1, "min": -1, "max": 2147483647 }
      ]
    },
    {
      "id": "replicate_nano_banana_2_img2img",
      "name": "Nano Banana 2 (img2img)",
      "endpoint": "google/nano-banana-2",
      "inputs": [
        { "name": "prompt", "data_type": "STRING", "api_field": "prompt", "required": true },
        { "name": "image", "data_type": "IMAGE", "api_field": "image", "api_format": "array", "required": true }
      ],
      "outputs": [
        { "name": "images", "data_type": "IMAGE", "api_field": "images" }
      ],
      "ref_roles": [
        { "role": "source", "api_field": "image", "max": 14 }
      ],
      "parameters": [
        { "name": "aspect_ratio", "label": "Aspect Ratio", "type": "enum", "api_field": "aspect_ratio", "default": "match_input_image",
          "options": ["match_input_image", "1:1", "4:3", "3:2", "16:9", "21:9", "5:4", "4:5", "3:4", "2:3", "9:16"] },
        { "name": "resolution", "label": "Resolution", "type": "enum", "api_field": "resolution", "default": "1K", "options": ["512px", "1K", "2K", "4K"] },
        { "name": "output_format", "label": "Format", "type": "enum", "api_field": "output_format", "default": "jpg", "options": ["png", "jpg"] },
        { "name": "safety_tolerance", "label": "Safety", "type": "int", "api_field": "safety_tolerance", "default": 2, "min": 1, "max": 6 },
        { "name": "seed", "label": "Seed", "type": "int", "api_field": "seed", "default": -1, "min": -1, "max": 2147483647 }
      ]
    }
  ]
}
