{
  "$schema": "../../docs/model.schema.json",
  "provider": "bytedance",
  "family": "Seedream 5.0 Pro",
  "category": "ByteDance/Image Generation",
  "nodes": [
    {
      "id": "bytedance_seedream5_pro_txt2img",
      "name": "Seedream 5.0 Pro (txt2img)",
      "endpoint": "dola-seedream-5-0-pro-260628",
      "inputs": [
        { "name": "prompt", "data_type": "STRING", "api_field": "prompt", "required": true }
      ],
      "outputs": [
        { "name": "image", "data_type": "IMAGE", "api_field": "images" }
      ],
      "parameters": [
        { "name": "size", "label": "Size", "type": "enum", "api_field": "size", "default": "2K", "options": ["1K", "2K"] },
        { "name": "output_format", "label": "Format", "type": "enum", "api_field": "output_format", "default": "jpeg", "options": ["jpeg", "png"] },
        { "name": "watermark", "label": "Watermark", "type": "bool", "api_field": "watermark", "default": true }
      ]
    },
    {
      "id": "bytedance_seedream5_pro_edit",
      "name": "Seedream 5.0 Pro (edit)",
      "endpoint": "dola-seedream-5-0-pro-260628",
      "inputs": [
        { "name": "prompt", "data_type": "STRING", "api_field": "prompt", "required": true },
        { "name": "image", "data_type": "IMAGE", "api_field": "image_urls", "api_format": "array", "required": true }
      ],
      "outputs": [
        { "name": "image", "data_type": "IMAGE", "api_field": "images" }
      ],
      "ref_roles": [
        { "role": "source", "api_field": "image_urls", "max": 10 }
      ],
      "parameters": [
        { "name": "size", "label": "Size", "type": "enum", "api_field": "size", "default": "2K", "options": ["1K", "2K"] },
        { "name": "output_format", "label": "Format", "type": "enum", "api_field": "output_format", "default": "jpeg", "options": ["jpeg", "png"] },
        { "name": "watermark", "label": "Watermark", "type": "bool", "api_field": "watermark", "default": true }
      ]
    }
  ]
}
