{
  "$schema": "../../docs/model.schema.json",
  "provider": "fal",
  "family": "Seedream 5.0 Pro",
  "category": "fal.ai/Image Generation",
  "nodes": [
    {
      "id": "seedream5_pro_txt2img",
      "name": "Seedream 5.0 Pro (txt2img)",
      "endpoint": "bytedance/seedream/v5/pro/text-to-image",
      "batch_field": "num_images",
      "inputs": [
        { "name": "prompt", "data_type": "STRING", "api_field": "prompt", "required": true }
      ],
      "outputs": [
        { "name": "images", "data_type": "IMAGE", "api_field": "images" }
      ],
      "parameters": [
        { "name": "image_size", "label": "Image Size", "type": "enum", "api_field": "image_size", "default": "auto_2K",
          "options": ["square_hd", "square", "portrait_4_3", "portrait_16_9", "landscape_4_3", "landscape_16_9", "auto_1K", "auto_2K"] },
        { "name": "num_images", "label": "Num Images", "type": "int", "api_field": "num_images", "default": 1, "min": 1, "max": 4 },
        { "name": "output_format", "label": "Format", "type": "enum", "api_field": "output_format", "default": "jpeg", "options": ["jpeg", "png"] },
        { "name": "enable_safety_checker", "label": "Safety Checker", "type": "bool", "api_field": "enable_safety_checker", "default": true }
      ]
    },
    {
      "id": "seedream5_pro_edit",
      "name": "Seedream 5.0 Pro (edit)",
      "endpoint": "bytedance/seedream/v5/pro/edit",
      "batch_field": "num_images",
      "inputs": [
        { "name": "prompt", "data_type": "STRING", "api_field": "prompt", "required": true },
        { "name": "image", "data_type": "IMAGE", "api_field": "image_urls", "api_format": "array", "required": true }
      ],
      "outputs": [
        { "name": "images", "data_type": "IMAGE", "api_field": "images" }
      ],
      "ref_roles": [
        { "role": "source", "api_field": "image_urls", "max": 10 }
      ],
      "parameters": [
        { "name": "image_size", "label": "Image Size", "type": "enum", "api_field": "image_size", "default": "auto_2K",
          "options": ["square_hd", "square", "portrait_4_3", "portrait_16_9", "landscape_4_3", "landscape_16_9", "auto_1K", "auto_2K"] },
        { "name": "num_images", "label": "Num Images", "type": "int", "api_field": "num_images", "default": 1, "min": 1, "max": 4 },
        { "name": "output_format", "label": "Format", "type": "enum", "api_field": "output_format", "default": "jpeg", "options": ["jpeg", "png"] },
        { "name": "enable_safety_checker", "label": "Safety Checker", "type": "bool", "api_field": "enable_safety_checker", "default": true }
      ]
    }
  ]
}
