{
  "$schema": "../../docs/model.schema.json",
  "provider": "replicate",
  "family": "Veo3",
  "category": "Replicate/Video Generation",
  "nodes": [
    {
      "id": "replicate_veo3_txt2vid",
      "name": "Veo3 (txt2vid)",
      "endpoint": "google/veo-3",
      "inputs": [
        { "name": "prompt", "data_type": "STRING", "api_field": "prompt", "required": true }
      ],
      "outputs": [
        { "name": "video", "data_type": "VIDEO", "api_field": "video" }
      ],
      "parameters": [
        { "name": "aspect_ratio", "label": "Aspect Ratio", "type": "enum", "api_field": "aspect_ratio", "default": "16:9", "options": ["16:9", "9:16"] },
        { "name": "duration", "label": "Duration", "type": "enum", "api_field": "duration", "default": "8s", "options": ["4s", "6s", "8s"] },
        { "name": "resolution", "label": "Resolution", "type": "enum", "api_field": "resolution", "default": "720p", "options": ["720p", "1080p"] },
        { "name": "generate_audio", "label": "Audio", "type": "bool", "api_field": "generate_audio", "default": true },
        { "name": "negative_prompt", "label": "Neg Prompt", "type": "enum", "api_field": "negative_prompt", "default": "", "options": [""] },
        { "name": "seed", "label": "Seed", "type": "int", "api_field": "seed", "default": -1, "min": -1, "max": 2147483647 }
      ]
    },
    {
      "id": "replicate_veo3_img2vid",
      "name": "Veo3 (img2vid)",
      "endpoint": "google/veo-3",
      "inputs": [
        { "name": "prompt", "data_type": "STRING", "api_field": "prompt", "required": true },
        { "name": "image", "data_type": "IMAGE", "api_field": "image" }
      ],
      "outputs": [
        { "name": "video", "data_type": "VIDEO", "api_field": "video" }
      ],
      "ref_roles": [
        { "role": "start", "api_field": "image", "max": 1 }
      ],
      "parameters": [
        { "name": "aspect_ratio", "label": "Aspect Ratio", "type": "enum", "api_field": "aspect_ratio", "default": "16:9", "options": ["16:9", "9:16"] },
        { "name": "duration", "label": "Duration", "type": "enum", "api_field": "duration", "default": "8s", "options": ["4s", "6s", "8s"] },
        { "name": "resolution", "label": "Resolution", "type": "enum", "api_field": "resolution", "default": "720p", "options": ["720p", "1080p"] },
        { "name": "generate_audio", "label": "Audio", "type": "bool", "api_field": "generate_audio", "default": true },
        { "name": "seed", "label": "Seed", "type": "int", "api_field": "seed", "default": -1, "min": -1, "max": 2147483647 }
      ]
    },
    {
      "id": "replicate_veo3_1_img2vid",
      "name": "Veo3.1 (img2vid)",
      "endpoint": "google/veo-3.1",
      "inputs": [
        { "name": "prompt", "data_type": "STRING", "api_field": "prompt", "required": true },
        { "name": "image", "data_type": "IMAGE", "api_field": "image" }
      ],
      "outputs": [
        { "name": "video", "data_type": "VIDEO", "api_field": "video" }
      ],
      "ref_roles": [
        { "role": "start", "api_field": "image", "max": 1 }
      ],
      "parameters": [
        { "name": "aspect_ratio", "label": "Aspect Ratio", "type": "enum", "api_field": "aspect_ratio", "default": "16:9", "options": ["16:9", "9:16"] },
        { "name": "duration", "label": "Duration", "type": "enum", "api_field": "duration", "default": "8s", "options": ["4s", "6s", "8s"] },
        { "name": "resolution", "label": "Resolution", "type": "enum", "api_field": "resolution", "default": "720p", "options": ["720p", "1080p"] },
        { "name": "generate_audio", "label": "Audio", "type": "bool", "api_field": "generate_audio", "default": true },
        { "name": "negative_prompt", "label": "Neg Prompt", "type": "enum", "api_field": "negative_prompt", "default": "", "options": [""] },
        { "name": "seed", "label": "Seed", "type": "int", "api_field": "seed", "default": -1, "min": -1, "max": 2147483647 }
      ]
    }
  ]
}
